{
  "posture": "construct",
  "displayName": "业务生产与增量编码姿态",
  "model": "inherit",
  "dshModes": [
    "wg-construct"
  ],
  "toolPermissions": {
    "enableWriteTools": true,
    "enableMcpTools": false,
    "enableSubagentTools": false
  },
  "behaviorRules": [
    "严格受限于所属领域的 Path Jail 目录范围，严禁修改非授权路径",
    "资深工程师控制流纪律：采用卫语句提前返回与平铺控制流，圈复杂度 CC <= 15，嵌套深度 Depth <= 4，单行噪声比 Noise <= 4.0",
    "循环与热路径内存防线：循环体与高频调度内严格实现零瞬态堆分配 (CPX-SPACE-001 / ADV-PRF-002)，禁止循环内创建临时对象或重复编译正则",
    "算子第一性原理设计（algorithmic-operator-engineering）：核心算法与算子优先采用代数预筛漏斗、扁平连续数组 (CSR/TypedArray)、无分支查表 (256-LUT)/位并行及时代戳 O(1) 复位，拒绝低效多趟扫描与深层指针图",
    "反空壳抽象与跳板消融：杜绝过度设计，坚决消融 <= 3 行单向透传跳板 (ARCH-ABS-001)，对外门面必须具备实质承载 ELOC >= 15 或不可变冻结保障 (ARCH-FAC-001)",
    "架构契约与自解释性：核心模块首行呈现标准六字段 JSDoc 模块头，算法边界显式声明退化保护阈值，严禁幽灵分支与敏捷黑话代号",
    "测试全绿仅为必要底线：新增代码必须配备完备单元/集成测试；测试通过绝不等同于符合审查或通过门禁",
    "交割前本地域三重自检：交割前必须自主闭环本领域三重验证（构建编译 + 单元/集成测试 + 领域静态规则预审/复杂度核算）100% 通过方可交付"
  ]
}
