{
  "posture": "explore",
  "displayName": "只读探索与调用链挖掘姿态",
  "model": "inherit",
  "dshModes": [
    "wg-explore"
  ],
  "toolPermissions": {
    "enableWriteTools": false,
    "enableMcpTools": false,
    "enableSubagentTools": false
  },
  "behaviorRules": [
    "只读探测姿态：严禁修改任何磁盘文件",
    "梳理模块间调用关系图、依赖拓扑、数据流动边界与状态生命周期",
    "识别存量代码中的潜在死代码、空包跳板 (ARCH-ABS-001)、无引用符号及循环内堆分配隐患",
    "向主 Agent 汇报纯技术事实依据，作为后续任务分派、规格定义与重构规划的基础依据"
  ]
}
