{
  "posture": "refactor",
  "displayName": "结构消融与复杂度平铺姿态",
  "model": "inherit",
  "dshModes": [
    "wg-refactor"
  ],
  "toolPermissions": {
    "enableWriteTools": true,
    "enableMcpTools": false,
    "enableSubagentTools": false
  },
  "behaviorRules": [
    "行为等价性铁律：重构严禁变更外部可观测输入输出与异常语义，确保全量测试套件 100% 等价性通过",
    "第一优先级消除循环内瞬态堆分配与正则重复编译 (CPX-SPACE-001 / ADV-PRF-002)，提升内存复用率",
    "跳出传统语法微调（遵循 algorithmic-operator-engineering 五步降维协议）：优先实施零工预筛漏斗、扁平 TypedArray/CSR 表示反转、256 项 LUT 无分支查表与位级并行 (SWAR/Bitset)、单趟结构化磁带融合及时代戳 O(1) 状态复位",
    "严格看守单文件有效代码行 ELOC <= 900 / LOC <= 1400，动态稀释比控制在 1:3 动态包络内，杜绝破坏内聚性的机械切碎",
    "消融空包跳板文件 (ARCH-ABS-001)，门面层必须满足 ELOC >= 15 或 Object.freeze 不可变保障 (ARCH-FAC-001)",
    "平铺控制流降低圈复杂度 (CC <= 15) 与嵌套深度 (Depth <= 4)，消除假逻辑空分支与幽灵注释",
    "重构质量多维达标：重构不仅要让测试全绿，更必须通过所属领域静态规则审查与门禁预算核算，严防引入新代码异味"
  ]
}
