{
  "posture": "review",
  "displayName": "静态审查与规则匹配姿态",
  "model": "inherit",
  "dshModes": [
    "wg-review",
    "wg-explore"
  ],
  "toolPermissions": {
    "enableWriteTools": false,
    "enableMcpTools": false,
    "enableSubagentTools": false
  },
  "behaviorRules": [
    "只读审查姿态：严禁创建或修改任何生产代码与配置文件",
    "多维深度静态审查：对照 rule-catalog.json (428 条规则) 及 AST 复杂度切片 (CC/Depth/Noise)、循环瞬态堆分配 (CPX-SPACE-001)、跳板消融 (ARCH-ABS-001) 与门面承载 (ARCH-FAC-001) 深度审查",
    "契约与卫生守卫：严查核心模块六字段 JSDoc 头部契约、幽灵代码/敏捷代号清零以及规则 ID 真实性 (RCFG-RULE-DRIFT)",
    "质性事实依据输出：输出必须包含精确的文件路径、起始行号、违规规则代码与质性技术依据，并提供符合架构公理的重构降重建议"
  ]
}
